{
  "schema": "role-handback/1",
  "chain": "arc-011-design",
  "step": 2,
  "role": "threat-modeler",
  "task": "T-3351",
  "status": "ready-for-review",
  "output": {
    "path": "docs/design/interactive-agent-communication-02-threat-model.md",
    "sha256": "8b3433e2ffeafeabe71b0ae1dd20a80a137fa0023d0915e95690c51f986ba6b8"
  },
  "inputs": [
    {
      "path": "docs/design/interactive-agent-communication-01-requirements.md",
      "sha256": "14aa257a0ea399426bcffb7d51b8008df843d9d115b7aea966cb1a776df897f2"
    },
    {
      "path": "docs/design/interactive-agent-communication/interview-step-01.md",
      "sha256": "aad8308e1924df293270d628b224dafc4814f675a4a61485dd2c1797a7114edd"
    },
    {
      "path": "docs/reports/T-3344-step1-rulings-summary.md",
      "sha256": "6381769f3b2a98f3bdc1e1cfe6c6c16c35891b5e5c9fedca55014ceaff13e418"
    },
    {
      "path": "docs/design/interactive-agent-communication-role-chain.yaml",
      "sha256": "ea67bf4fc4638f2271d53f05240d11a2c2e50c232d1d6945ac13514ec9e62c26"
    }
  ],
  "summary": "Revision round 1 (v0.2) of the arc-011 threat model, answering Codex (return for revision) and GLM (fit with fixes): 36 findings checked, 31 valid, 5 partly, 0 not valid (disposition-r1.md). Four fidelity changes withdrawn or made explicit: no interrupt allow-list at circuit set-up (R-52.a, R-63.a); revocation never makes mail DEAD (R-44, R-60); PR-15 limited to resume, takeover unchanged (R-67, R-68); retention per R-35.o; PR-5 binding as R-60.a (2e); no 'allowed peer' class. Over-claims fixed: circuit lifetime from establishment and never reset; revocation split into 7 scopes with reachable and partitioned bounds; SI-9, 13, 17, 19, 21, 22 restated; contiguous receipts; identity-keyed namespaces. Added: ADV-14 and the operator approval device; TH-58..65 (65 threats); SI-29..31 (31 invariants); RR-15..19 (19 residuals); CR-14, CR-15 (15 change requests); OQ-10..14; PR-26..33; invariant-to-CR table (18.2); numbers labelled hypotheses. Drawings D-1 and D-2 corrected and all four re-rendered. Step-1 requirements not changed.",
  "completion": [
    {
      "condition": "6.1 Every trust boundary has all six STRIDE questions answered, plus confused deputy, approved-not-executed, replay and break-glass",
      "met": true,
      "evidence": "Section 14 (TB-1..TB-13, ten answers each); TB-6 marked conditional on OQ-4 A (14.7.1); approval replay, transcript forgery and credential replay now answered by mechanisms that state their limits (SI-13, SI-17, SI-9)"
    },
    {
      "condition": "6.2 Every threat has a countermeasure or is a listed residual risk",
      "met": true,
      "evidence": "Section 15 (TH-1..TH-65, index in 15.1.a, likelihood and impact reasons on every threat) and section 20 (RR-1..RR-19)"
    },
    {
      "condition": "6.3 The bypass inventory is complete for the routes the profile names, and says what remains open",
      "met": true,
      "evidence": "Section 17: BP-1..BP-19; 17.1.a defines 'monitored' and its limit; 17.2 and RR-18 say what stays open"
    },
    {
      "condition": "6.4 Security invariants are stated so a test or probe could check them",
      "met": true,
      "evidence": "Section 18: SI-1..SI-31 each with a probe; 18.2 gives each invariant's standing, dependency on change requests, limit and whether its probe can run; SI-17, SI-21 and SI-22 restated to what their mechanism delivers"
    },
    {
      "condition": "6.5 Every required drawing D-1 to D-4 is present with id, caption and textual equivalent, and renders without error",
      "met": true,
      "evidence": "D-1 5.1, D-2 and D-3 in 16, D-4 in 17; D-1 and D-2 corrected; mmdc render check re-run on all four after the changes, exit 0 each, no error (24.2)"
    }
  ],
  "open_questions": [
    "22 OQ-1..OQ-14 (OQ-10 to OQ-14 are new; OQ-5 and OQ-7 split)",
    "8.6.b who may start a conversation hand-over, and 8.6.d what a joiner reads (OQ-12, OQ-13)",
    "12.3 whether the hub copy of a circuit turn carries content (OQ-10, CR-9)",
    "4.4 shared operating-system user (OQ-2); closes only the user-level part of RR-2, not host root",
    "19 every proposed number is an unmeasured hypothesis (H-1..H-9)",
    "1.3.b this project has no design-render-check.py or role-handback-check.py: render check done with mmdc"
  ],
  "change_requests": [
    {
      "step": 1,
      "what": "CR-1 R-45.a, R-26.o and R-44.a conflict with R-7.e (1): with the hub unreachable on a circuit, stages, replies and sender-visible states cannot be hub-first. Local hash-chained log first, replayed on return; reply carried on the circuit; state computed from circuit receipts and labelled unreconciled, UNKNOWN only when nothing can be read; write-ahead intent before hand-over."
    },
    {
      "step": 1,
      "what": "CR-2 No requirement says messages are signed by a per-agent key and verified (GP-1; R-34.e (2) says authentication is not required, R-63 relies on a verified key)."
    },
    {
      "step": 1,
      "what": "CR-3 R-51.a: identity should be (sender identity, conversation id, message id) bound to a content digest, with a CONFLICT outcome for the same id with different content."
    },
    {
      "step": 1,
      "what": "CR-4 R-59.a: receipts signed, forward-only, contiguous and bounded by what was stored; random first number; counter rebuilt from the hub record; equivocation outcome; namespace survives key rotation."
    },
    {
      "step": 1,
      "what": "CR-5 R-23.a and R-23.e: make 'no peer content in the typed line' firm, constrain ids to 32 hex characters, require a foreground-process check before typing and a re-check just before."
    },
    {
      "step": 1,
      "what": "CR-6 R-50 and R-47: frame produced by the receiving adapter with a random boundary, a size cap, two trust classes plus an allow-list fact line (no third class), no peer message as approval, applied to every rail that puts peer text in an agent's context."
    },
    {
      "step": 1,
      "what": "CR-7 R-46: add the sender-constrained, connection-bound, scoped credential, establishment nonce and set-up window, lifetime from establishment never reset, signed revocation list with rollback protection and a stale rule, and a stated lifetime. No allow-list check at set-up (R-52.a, R-63.a)."
    },
    {
      "step": 1,
      "what": "CR-8 R-60 and R-61: fleet admission roster, signed cards, home-hub binding as R-60.a (2e) rules it, project root key, signed hub-key rotation and moved-to statements, no-guess rule at first sight, hub signing key apart from the TLS certificate."
    },
    {
      "step": 1,
      "what": "CR-9 R-35, R-45, R-15: say whether the hub copy of a circuit turn carries content, and whether content is protected from token holders and from the hub operator."
    },
    {
      "step": 1,
      "what": "CR-10 R-63.a: the default allow-list 'own project plus the operator' has no authenticated operator identity until GP-11 is ruled."
    },
    {
      "step": 1,
      "what": "CR-11 R-53.a and R-63: peers should see only reachable yes or no and the version class, not the four reachability fields."
    },
    {
      "step": 1,
      "what": "CR-12 R-65.a and R-60: DEAD must be signed, and a resume (not a takeover) needs a host-local check that no process holds the session. R-67 and R-68 unchanged; the earlier takeover check is withdrawn."
    },
    {
      "step": 1,
      "what": "CR-13 R-67.a and R-64: role eligibility from operator-signed configuration; grants, allow-lists and roster take effect only with an operator signature or a hub-held verified record. Depends on CR-14."
    },
    {
      "step": 1,
      "what": "CR-14 New, touches GP-11 and R-63.a: an operator approval key and device with second factor, single-use short-lived digest-bound approvals, second-channel notice with a delay, offline recovery key."
    },
    {
      "step": 1,
      "what": "CR-15 New, touches R-62.a: conversation membership (R-1.e (2) many-to-many, R-62 hand-over) changes only by a signed, countersigned, recorded event or a hand-over under a stated rule."
    }
  ],
  "decisions_needed": [
    "OQ-1 confirm adversaries ADV-11, ADV-12, ADV-13, ADV-14 (recommend A: all four)",
    "OQ-2 shared operating-system user (recommend C: accept now, record the option; B closes only the user-level part)",
    "OQ-3 circuit credential lifetime (recommend B, which rests on hypothesis H-1, outage length, not measured)",
    "OQ-4 same-host new conversation without the hub (recommend A; TB-6 matrix is written for A)",
    "OQ-5 how strong STORED is: process and host crash survived, or process crash only (recommend A)",
    "OQ-6 meaning of 'operator' as a sender until GP-11 (A nothing operator-class; B as R-63.a; C assess authenticated channels; recommend A for the floor, assess C under GP-11)",
    "OQ-7 token holders reading content on the hub (recommend A now)",
    "OQ-8 fleet admission with the continuity rules of 10.5 (recommend A; needs the T-2470 charter rewording)",
    "OQ-9 take the numbers of section 19 as starting values, all hypotheses (recommend A, except PN-1, PN-2, PN-13 and PN-14)",
    "OQ-10 hub keeps circuit-turn content or metadata only (recommend A until OQ-11 is ruled)",
    "OQ-11 hub operator reading content: accept, or end-to-end encryption later (recommend B as a later slice)",
    "OQ-12 who may add a participant or hand a conversation over (recommend A)",
    "OQ-13 what a new participant may read (recommend A: from joining forward)",
    "OQ-14 protections for the operator's approval device and key (recommend A: all four)",
    "Accept or reject residual risks RR-1..RR-19 (section 20), one per line (the task's Human AC)",
    "Accept or reject change requests CR-1..CR-15 to the requirements (section 21)"
  ]
}
