{
  "schema": "role-handback/1",
  "chain": "arc-011-design",
  "step": 3,
  "role": "mvp-specialist",
  "task": "T-3352",
  "status": "ready-for-review",
  "output": {
    "path": "docs/design/interactive-agent-communication-03-floor-and-phasing.md",
    "sha256": "7e914a97482a607106ddc5bb7a270a8453768e2098dcd18a28dd38d1503eeb32"
  },
  "inputs": [
    {
      "path": "docs/design/interactive-agent-communication-01-requirements.md",
      "sha256": "d2d839fb743eb4c542f337f2b3d244e3df4a47ac40807ebbc5f7dda5ead0a3d4"
    },
    {
      "path": "docs/design/interactive-agent-communication-02-threat-model.md",
      "sha256": "88961693384966502f4ca4eb515ed4b0590a29c3d61ac0c619e17ea4562693f3"
    }
  ],
  "summary": "Proposes the security floor (31 invariants SI-1..31 plus 8 extras FX-1..8, each with the phase it enters and completes, and a note where it needs per-agent accounts or the operator key), the prioritisation of all 82 requirements, a basic version on a disposable estate with 17 fail-closed rows, seven phases PH-0..PH-6 with exit criteria and rollback, 28 hypotheses (H-14 and H-21 can refute the approach), the GP-12 numbers (60 s diagnosis, 14 states and 8 markers), CAND-3 staging in 21 dimensions, and the four items left to this step: account phasing and price, Tier 0 risk classes, the policy record format, the interim controls, plus outage-log reconciliation rules. Eight risk-acceptance requests and 20 one-at-a-time operator questions. Nothing is approved.",
  "completion": [
    {
      "condition": "6.1 Every SI-n and every irreversible-action requirement is in the floor or has a recorded risk-acceptance request",
      "met": true,
      "evidence": "Section 3 (3.3 SI-1..31, 3.4 FX-1..8, 3.5 all 33 security-typed requirements, 3.6 outside with reasons); section 11 RA-1..RA-8"
    },
    {
      "condition": "6.2 Every other requirement has a priority and a reason",
      "met": true,
      "evidence": "Section 4.2: a row for each of R-1..R-82 plus PR-11; counts in 4.3"
    },
    {
      "condition": "6.3 Every phase has exit criteria and rollback; at least one hypothesis can refute the approach",
      "met": true,
      "evidence": "Section 6.2.1 to 6.2.7 (PH-1 via 5.9 and 6.2.2); H-14 and H-21 in section 9"
    },
    {
      "condition": "6.4 Every required drawing (D-1 to D-2) is present with id, caption and textual equivalent, and renders without error",
      "met": true,
      "evidence": "D-2 in 3.7 with 3.8; D-1 in 6.7 with 6.8; mmdc exit 0 for both, section 16"
    }
  ],
  "open_questions": [
    "13.2.1 OP-1 accounts order and price",
    "13.2.2 OP-2 policy-route classes",
    "13.2.3 OP-3 high-impact classes",
    "13.2.4 OP-4 policy record format and defaults (055 waits)",
    "13.2.5 OP-5 interim control placement",
    "13.2.6 OP-6 diagnosis-time bound",
    "13.2.7 OP-7 state cap",
    "13.2.8 OP-8 GP-12 for AEF receiver",
    "13.2.9 OP-9 reconciliation rules",
    "13.2.10 OP-10 confirm the floor",
    "13.2.11 OP-11 confirm phasing, basic version, staging",
    "13.2.12 OP-12 hypothesis thresholds",
    "13.2.13 OP-13..OP-20 risk-acceptance requests RA-1..RA-8"
  ],
  "change_requests": [
    {
      "step": 2,
      "what": "CX-1: add bypass route BP-20 (shared writable checkout and hook configuration as a lateral path between agent accounts) and residual risk RR-21; consider invariant SI-32 (floor code installed read-only and verified at session start)."
    },
    {
      "step": 1,
      "what": "CX-2: clarify which hook point delivers which priority; R-48.e (any message at the next tool call) and R-63.a (mid-turn only for urgent from allowed senders) read differently; phasing assumes normal at turn end."
    },
    {
      "step": 1,
      "what": "CX-3 (conditional on OP-4): if eligible_for_main defaults to no, reword R-67.a1 (1) and CR-20 (1)."
    },
    {
      "step": 1,
      "what": "CX-4 bookkeeping: close the open items pointing at step 3 (R-6.e (2), R-70.g, R-45.a, R-72.g, R-76.g, R-73.g, R-82.g, R-6.g) and set the R-3.e (3) bound to the R-44.e deadline once ruled."
    }
  ],
  "decisions_needed": [
    "Confirm the floor (39 items) and the phasing; take OP-1..OP-12 one at a time.",
    "Rule RA-1..RA-8 (risk acceptance), each its own question.",
    "Decide T-2470 (charter rewording) before PH-3.",
    "Approve sending the policy record format to 055 after OP-4 (not sent by this role)."
  ]
}
